{
  "schema_version": "dps.legacy-csharp-bytes/v1",
  "baseline_commit": "cac7ccbcce927a1a3a62cfd376497f0d30cc47e4",
  "inventory_scope": "TRACKED_LEGACY_CSHARP_PLUS_APPROVED_REPAIRS",
  "entry_count": 79,
  "entries": [
    {
      "path": "Core/ErrorRecovery.cs",
      "baseline_git_blob": "4b715b5ac548dd3ad7d4f3a4560a72e26d6cad18",
      "baseline_sha256": "1efa01d15d4944927c8b5e6e9d6af7b5cd327782d6a7b44c4d314fb4c610965c",
      "baseline_byte_length": 6958,
      "working_sha256": "1efa01d15d4944927c8b5e6e9d6af7b5cd327782d6a7b44c4d314fb4c610965c",
      "working_byte_length": 6958,
      "disposition": "BYTE_IDENTICAL",
      "approval_ref": null
    },
    {
      "path": "Core/HumanizationEngine.cs",
      "baseline_git_blob": "c5a6c8202d080d749096f393a94e5d1966a24dbd",
      "baseline_sha256": "939b12b69fbefac8615e0d58262c6155938d4fa4ef33804451fd673e371a415b",
      "baseline_byte_length": 1582,
      "working_sha256": "939b12b69fbefac8615e0d58262c6155938d4fa4ef33804451fd673e371a415b",
      "working_byte_length": 1582,
      "disposition": "BYTE_IDENTICAL",
      "approval_ref": null
    },
    {
      "path": "Core/ScriptHelpers.cs",
      "baseline_git_blob": "de8bb78c3097ee2b5c1ffc1e064a52cc69580dca",
      "baseline_sha256": "bafb0672fdd6283962995bc3bcdb7396cd8079b4744f6f6f65e547d62b8a292e",
      "baseline_byte_length": 10276,
      "working_sha256": "bafb0672fdd6283962995bc3bcdb7396cd8079b4744f6f6f65e547d62b8a292e",
      "working_byte_length": 10276,
      "disposition": "BYTE_IDENTICAL",
      "approval_ref": null
    },
    {
      "path": "Core/UILocator.cs",
      "baseline_git_blob": "492522f5559706a64215225dd729c6063ea4b82b",
      "baseline_sha256": "ab03b68d7b29d936bae9b3fa31c6982cf551bf4783d0ed1005d6d048adac60ea",
      "baseline_byte_length": 8758,
      "working_sha256": "ab03b68d7b29d936bae9b3fa31c6982cf551bf4783d0ed1005d6d048adac60ea",
      "working_byte_length": 8758,
      "disposition": "BYTE_IDENTICAL",
      "approval_ref": null
    },
    {
      "path": "Extensions/DataSources/IPLocationExtension.cs",
      "baseline_git_blob": "30581f4227beebeed7d43ef289431e9b9e7ebb09",
      "baseline_sha256": "dbbf730b2e3a00d715be2531dc5f3a642d102f0414d2b1f1976ded4d23cb9ce3",
      "baseline_byte_length": 4708,
      "working_sha256": "dbbf730b2e3a00d715be2531dc5f3a642d102f0414d2b1f1976ded4d23cb9ce3",
      "working_byte_length": 4708,
      "disposition": "BYTE_IDENTICAL",
      "approval_ref": null
    },
    {
      "path": "Extensions/DataSources/WeatherExtension.cs",
      "baseline_git_blob": "aa22bf44cac6880bb1e2d7ef5c1410c2ed837a06",
      "baseline_sha256": "e03bfab97603b61376c8f3f0264cec379373ba2081df10316d979e644c67ce3a",
      "baseline_byte_length": 6227,
      "working_sha256": "e03bfab97603b61376c8f3f0264cec379373ba2081df10316d979e644c67ce3a",
      "working_byte_length": 6227,
      "disposition": "BYTE_IDENTICAL",
      "approval_ref": null
    },
    {
      "path": "Modules/Core/AIService.cs",
      "baseline_git_blob": "97d3ce5a3d192261aa6a0df589971e8a9e6bab52",
      "baseline_sha256": "b914aff9bbc55141835c3b945f1ea1e3a162e6da21573dda506cd65b8ddde8ec",
      "baseline_byte_length": 27774,
      "working_sha256": "b914aff9bbc55141835c3b945f1ea1e3a162e6da21573dda506cd65b8ddde8ec",
      "working_byte_length": 27774,
      "disposition": "BYTE_IDENTICAL",
      "approval_ref": null
    },
    {
      "path": "Modules/Core/ActionExecutor.cs",
      "baseline_git_blob": "e17fb9aaddd0dc90fc1a393186e077e31b0d6bb4",
      "baseline_sha256": "66d797a0394fa423d244d623d929c33faea493e3141683e64a04c14d814d28eb",
      "baseline_byte_length": 57791,
      "working_sha256": "66d797a0394fa423d244d623d929c33faea493e3141683e64a04c14d814d28eb",
      "working_byte_length": 57791,
      "disposition": "BYTE_IDENTICAL",
      "approval_ref": null
    },
    {
      "path": "Modules/Core/AppExplorer.cs",
      "baseline_git_blob": "622ce075110c483794cbe5a382c0e5b741376900",
      "baseline_sha256": "514ad171214f170431e27381a0b664e8aedd3d9b5c1dd0c5e3b16d4f3f16fa39",
      "baseline_byte_length": 26274,
      "working_sha256": "514ad171214f170431e27381a0b664e8aedd3d9b5c1dd0c5e3b16d4f3f16fa39",
      "working_byte_length": 26274,
      "disposition": "BYTE_IDENTICAL",
      "approval_ref": null
    },
    {
      "path": "Modules/Core/AppExplorer_v2.cs",
      "baseline_git_blob": "a2738122bc9e3ba22fe7e1e8a6ad2e92b2457a5b",
      "baseline_sha256": "9e980f0cbbe6f2c0e5ee6b69aef23b2fa0e86fe5df5a6ef7ee5973a418a55cf7",
      "baseline_byte_length": 25278,
      "working_sha256": "9e980f0cbbe6f2c0e5ee6b69aef23b2fa0e86fe5df5a6ef7ee5973a418a55cf7",
      "working_byte_length": 25278,
      "disposition": "BYTE_IDENTICAL",
      "approval_ref": null
    },
    {
      "path": "Modules/Core/CoreHelper.cs",
      "baseline_git_blob": "f46c596e4d4769bfa1752343ba735f5ac969f8fb",
      "baseline_sha256": "0df934d8092911244560aa9bbcd3f9ff75cecbe147e449d6fe22def30da16a26",
      "baseline_byte_length": 15000,
      "working_sha256": "0df934d8092911244560aa9bbcd3f9ff75cecbe147e449d6fe22def30da16a26",
      "working_byte_length": 15000,
      "disposition": "BYTE_IDENTICAL",
      "approval_ref": null
    },
    {
      "path": "Modules/Core/ExtensionManager.cs",
      "baseline_git_blob": "87d36d26e1704849b474844cbeb807ddaa132fc2",
      "baseline_sha256": "9bf5837a52318001f68200b8c6565a36eff97096c2047797b6705d2bfa871020",
      "baseline_byte_length": 10979,
      "working_sha256": "9bf5837a52318001f68200b8c6565a36eff97096c2047797b6705d2bfa871020",
      "working_byte_length": 10979,
      "disposition": "BYTE_IDENTICAL",
      "approval_ref": null
    },
    {
      "path": "Modules/Core/FileHelper.cs",
      "baseline_git_blob": "6bfd37cafb30eee26a90be5c2f0caf8836dab825",
      "baseline_sha256": "92f98cb3618c28dfcc24e4ba48097a966b929af635dfdfdfcf23c99b7a893b69",
      "baseline_byte_length": 8212,
      "working_sha256": "92f98cb3618c28dfcc24e4ba48097a966b929af635dfdfdfcf23c99b7a893b69",
      "working_byte_length": 8212,
      "disposition": "BYTE_IDENTICAL",
      "approval_ref": null
    },
    {
      "path": "Modules/Core/IExtension.cs",
      "baseline_git_blob": "a1398e90ab2557f74c19d435a1cc44cb89e4e673",
      "baseline_sha256": "5aec0d179360d04f80ee90e26f0847ed7b91d3ba078969b31729b40d5603004d",
      "baseline_byte_length": 1355,
      "working_sha256": "5aec0d179360d04f80ee90e26f0847ed7b91d3ba078969b31729b40d5603004d",
      "working_byte_length": 1355,
      "disposition": "BYTE_IDENTICAL",
      "approval_ref": null
    },
    {
      "path": "Modules/Core/Intent.cs",
      "baseline_git_blob": "8a8c82e7075f992109270380b49ae5bfb2fa30f1",
      "baseline_sha256": "52c4da5b99c6746bea76c51edf74a0a0885ebd55210f09e541a43aac5d2b4ce5",
      "baseline_byte_length": 6125,
      "working_sha256": "52c4da5b99c6746bea76c51edf74a0a0885ebd55210f09e541a43aac5d2b4ce5",
      "working_byte_length": 6125,
      "disposition": "BYTE_IDENTICAL",
      "approval_ref": null
    },
    {
      "path": "Modules/Core/IntentTranslator.cs",
      "baseline_git_blob": "ce47b1b3669ec7910760106916c89716d1bcd992",
      "baseline_sha256": "7a4e9dc10cbdddc12fd89fdba30071faf96af851042f30f8a76b3b1e2523e4c8",
      "baseline_byte_length": 14400,
      "working_sha256": "7a4e9dc10cbdddc12fd89fdba30071faf96af851042f30f8a76b3b1e2523e4c8",
      "working_byte_length": 14400,
      "disposition": "BYTE_IDENTICAL",
      "approval_ref": null
    },
    {
      "path": "Modules/Core/JsonHelper.cs",
      "baseline_git_blob": "df6fc171b64d68cd8fa8fe099c54c2680a8b8e39",
      "baseline_sha256": "6e25fc5d5392020e5ee73d6d26486dcc31ab47794e859cd93989d3a101fc7e71",
      "baseline_byte_length": 28631,
      "working_sha256": "6e25fc5d5392020e5ee73d6d26486dcc31ab47794e859cd93989d3a101fc7e71",
      "working_byte_length": 28631,
      "disposition": "BYTE_IDENTICAL",
      "approval_ref": null
    },
    {
      "path": "Modules/Core/ManifestLoader.cs",
      "baseline_git_blob": "63a50790c65a3c24168bb5655a0a100a84296c36",
      "baseline_sha256": "7e57755cb872772904b0be57ed32b956367e9a7f4c6e1800bf527d9ad9342a7d",
      "baseline_byte_length": 5129,
      "working_sha256": "7e57755cb872772904b0be57ed32b956367e9a7f4c6e1800bf527d9ad9342a7d",
      "working_byte_length": 5129,
      "disposition": "BYTE_IDENTICAL",
      "approval_ref": null
    },
    {
      "path": "Modules/Core/NavigationResolver.cs",
      "baseline_git_blob": "7f8f6bd59cac02e47f966a24af3315f615521077",
      "baseline_sha256": "85fe9a4f9e0345fb1d774747e17fc428737c0e070a85956977d554740b2d7cd5",
      "baseline_byte_length": 8725,
      "working_sha256": "85fe9a4f9e0345fb1d774747e17fc428737c0e070a85956977d554740b2d7cd5",
      "working_byte_length": 8725,
      "disposition": "BYTE_IDENTICAL",
      "approval_ref": null
    },
    {
      "path": "Modules/Core/OperationContext.cs",
      "baseline_git_blob": "805803cb830f269d13faa4cadaad669a02b6e5a6",
      "baseline_sha256": "813df3971beb7dd03203fc10fc7c8be14fccd81fd2ea1e866212af2f1326c0ae",
      "baseline_byte_length": 5201,
      "working_sha256": "813df3971beb7dd03203fc10fc7c8be14fccd81fd2ea1e866212af2f1326c0ae",
      "working_byte_length": 5201,
      "disposition": "BYTE_IDENTICAL",
      "approval_ref": null
    },
    {
      "path": "Modules/Core/PageDetector.cs",
      "baseline_git_blob": "4b1fc5bc2e6d7fbc2014339aa1a6f787c4ba0718",
      "baseline_sha256": "1f91a55a2cc251b044dc85a9993cf885f2099c07aa9348880e19666a8341c66e",
      "baseline_byte_length": 12111,
      "working_sha256": "1f91a55a2cc251b044dc85a9993cf885f2099c07aa9348880e19666a8341c66e",
      "working_byte_length": 12111,
      "disposition": "BYTE_IDENTICAL",
      "approval_ref": null
    },
    {
      "path": "Modules/Core/RateLimiter.cs",
      "baseline_git_blob": "3554bf5c927ee200c6c04851cc13ca1536857505",
      "baseline_sha256": "3dcd8a2b73f7a91253ea7aaf177041ca76b75e3ba566dece6cc15b9aae3bf0c3",
      "baseline_byte_length": 6018,